category_id,name,slug,description,image_url,is_active,created_at
7c144152-c887-5fd4-b956-215cd33de698,Bánh Gato,banh-gato,Bánh gato truyền thống nhiều hương vị,,True,2026-06-27T00:56:55.277290
86fd30aa-31fa-5c90-9e30-bd90f62c6f4f,Bánh Entremet,banh-entremet,Bánh entremet cao cấp nhiều lớp,,True,2026-06-27T00:56:55.277290
d38a3689-b691-57ed-8d00-9cce9a1251bd,Bánh Mousse,banh-mousse,"Bánh mousse mịn, nhẹ, đa dạng vị",,True,2026-06-27T00:56:55.277290
38625481-8435-5399-a917-738024d901c0,Bánh nướng,banh-nuong,Bánh nướng giòn thơm,,True,2026-06-27T00:56:55.277290
95cee8e2-a59e-5ea3-9756-c749943fc8ab,Mini Cakes,mini-cakes,Bánh mini xinh xắn,,True,2026-06-27T00:56:55.277290
a2fc694e-9225-564c-8d53-68632bfc2fc7,Tiramisu,tiramisu,Bánh tiramisu Ý đặc trưng,,True,2026-06-27T00:56:55.277290
